{
  "schemaVersion": "1.0.0",
  "productId": "developer-tools",
  "purpose": "Declare the privacy boundary for Developer Tools before public product exposure.",
  "dataClasses": [
    "project_settings",
    "local_validation_reports",
    "examples",
    "release_evidence"
  ],
  "userBoundary": "No production Developer Tools data may be collected until privacy, support, and runtime witness gates close.",
  "retentionPolicy": "privacy/developers.retention.json",
  "collectionState": "not-active"
}
