{
  "schemaVersion": "1.0.0",
  "productId": "mullu-govern",
  "purpose": "Declare the privacy boundary for Mullu Govern before public product exposure.",
  "dataClasses": [
    "policy_records",
    "evaluations",
    "traces",
    "proof_stamps",
    "audit_events"
  ],
  "userBoundary": "No production Mullu Govern data may be collected until privacy, support, and runtime witness gates close.",
  "retentionPolicy": "privacy/govern.retention.json",
  "collectionState": "not-active"
}
